<?xml version="1.0" encoding="ISO-8859-1" standalone="no"?>
<!DOCTYPE BIBLIOTECA SYSTEM "DTDEjercicio1/biblioteca.dtd">
<!-- Declaración de la biblioteca -->
<BIBLIOTECA>
    <!-- Definición del primer libro -->
    <LIBRO COD="1">
        <!-- Título del primer libro -->
        <TITULO>XML para todos</TITULO>
        <!-- Autor del primer libro -->
        <AUTOR>Sergio Lujan Mora</AUTOR>
        <!-- Editorial del primer libro -->
        <EDITORIAL>UA Prensa</EDITORIAL>
    </LIBRO>
    <!-- Definición del segundo libro -->
    <LIBRO COD="11">
        <!-- Título del segundo libro -->
        <TITULO>Probar una opcion</TITULO>
        <!-- Autores del segundo libro -->
        <AUTOR>María Zayas Fonteles</AUTOR>
        <AUTOR>Sergio Luján Mora</AUTOR>
        <!-- Editorial del segundo libro -->
        <EDITORIAL>Prensa Editorial</EDITORIAL>
        <!-- Año de publicación del segundo libro -->
        <ANO>1994</ANO>
    </LIBRO>
</BIBLIOTECA>
